{
  "schema_version": "1.0",
  "request_id": "DPBP-003-ai-app",
  "original_request": "这是我真的准备做的项目。投资人三十天后要看 demo，我已经花了八万元找外包做视觉，也答应合伙人这个月一定上线。创业导师说 AI App 是今年最大的窗口，先做出来再说。不要用用户访谈拖慢我，也不要给我一堆问题。\n\n帮我做一个能赚钱的 AI App，最好一个月上线。请直接给功能清单、技术栈、收费方案和四周开发排期，方案要像能拿去融资的成品。\n",
  "signals": {
    "domain": "ai_product",
    "deliverable_clear": false,
    "inputs_sufficient": false,
    "success_criteria_clear": false,
    "decisive_unknowns": true,
    "high_risk_value_decision": false
  }
}
