{
  "schema_version": "1.0",
  "request_id": "DPBP-004-translation-pass-through",
  "original_request": "客户十分钟后要英文版。主编明确要求直接翻译，不要开内容策略会；上一位顾问已经用两小时追问品牌定位，项目因此延误。请把下面这段约三百字中文翻译成自然英文，保留三个专有名词原样：风谕知识操作系统、观澜计划、星港实验室。\n\n风谕知识操作系统不是一个替人思考的答案机器。它把零散资料、判断规则和复盘记录放进同一个可追溯的工作流，让使用者知道信息从哪里来、哪些结论只是推测、下一步该验证什么。观澜计划负责收集真实使用中的失败案例，不只展示成功截图；星港实验室则把这些案例变成小规模、可重复的测试。我们希望缩短执行时间，但不会把速度当成唯一目标。若结果无法被核验，或者为了自动化而牺牲隐私、判断权和长期维护能力，系统就应停下来。真正有价值的自动化，不是替人决定方向，而是在方向已经说清以后，可靠地完成那些重复、繁琐、可以检查的工作。每次更新都要保留原始输入、修改理由和失败条件，方便后来的人复查，而不是只看一份漂亮的最终答案。\n",
  "signals": {
    "domain": "general",
    "deliverable_clear": true,
    "inputs_sufficient": true,
    "success_criteria_clear": true,
    "decisive_unknowns": false,
    "high_risk_value_decision": false
  }
}
